{
  "$schema": "https://json-schema.org/draft/2020-12/schema",
  "additionalProperties": false,
  "properties": {
    "checks": {
      "items": {
        "additionalProperties": false,
        "properties": {
          "description": {
            "minLength": 1,
            "type": "string"
          },
          "details": {},
          "id": {
            "minLength": 1,
            "type": "string"
          },
          "status": {
            "enum": [
              "PASS",
              "FAIL"
            ],
            "type": "string"
          }
        },
        "required": [
          "id",
          "description",
          "status",
          "details"
        ],
        "type": "object"
      },
      "minItems": 1,
      "type": "array"
    },
    "fail_closed_confirmed": {
      "type": "boolean"
    },
    "git_sha": {
      "minLength": 7,
      "type": "string"
    },
    "lint_enabled": {
      "type": "boolean"
    },
    "semgrep_enabled": {
      "type": "boolean"
    },
    "status": {
      "enum": [
        "PASS",
        "FAIL"
      ],
      "type": "string"
    },
    "suppression_audit_enabled": {
      "type": "boolean"
    },
    "task_id": {
      "const": "R-021",
      "minLength": 1,
      "type": "string"
    },
    "timestamp_utc": {
      "format": "date-time",
      "type": "string"
    }
  },
  "required": [
    "task_id",
    "git_sha",
    "timestamp_utc",
    "status",
    "checks",
    "lint_enabled",
    "semgrep_enabled",
    "fail_closed_confirmed",
    "suppression_audit_enabled"
  ],
  "title": "R-021 CI SQL Guard Evidence",
  "type": "object"
}