{
  "task_id": "R-021",
  "git_sha": "d1841acccfa86da0659b43ee5c05fae527acf4b3",
  "timestamp_utc": "2026-03-04T20:18:47Z",
  "status": "PASS",
  "checks": [
    {
      "id": "R-021-A1",
      "description": "security_scan runs lint_app_sql_injection and semgrep",
      "status": "PASS",
      "details": {
        "lint_app_sql_injection": true,
        "semgrep": true
      }
    },
    {
      "id": "R-021-A2",
      "description": "security_scan is fail-closed",
      "status": "PASS",
      "details": {
        "continue_on_error": false,
        "pipefail_present": true
      }
    },
    {
      "id": "R-021-A3",
      "description": "Suppressions require justification+expiry and are audited in CI",
      "status": "PASS",
      "details": {
        "suppression_audit_script": true,
        "scan_scope": "git_tracked"
      }
    }
  ],
  "lint_enabled": true,
  "semgrep_enabled": true,
  "fail_closed_confirmed": true,
  "suppression_audit_enabled": true
}
